{
  "$schema": "http://json-schema.org/draft-07/schema#",
  "$id": "https://jtk25.my.id/schemas/announcements.json",
  "title": "Announcements",
  "description": "Daftar pengumuman untuk mahasiswa JTK25",
  "type": "object",
  "required": ["schema", "semester", "updatedAt", "data"],
  "properties": {
    "schema": {
      "type": "integer",
      "const": 2,
      "description": "Schema version, always 2"
    },
    "semester": {
      "type": "string",
      "pattern": "^\\d{4}/\\d{4}-(GANJIL|GENAP)$"
    },
    "updatedAt": {
      "type": "string",
      "format": "date-time"
    },
    "data": {
      "type": "array",
      "items": {
        "$ref": "#/$defs/Announcement"
      }
    }
  },
  "additionalProperties": false,
  "$defs": {
    "Announcement": {
      "type": "object",
      "required": ["id", "title", "body", "createdAt"],
      "properties": {
        "id": {
          "type": "string",
          "description": "Unique identifier"
        },
        "title": {
          "type": "string",
          "minLength": 1,
          "description": "Announcement title"
        },
        "body": {
          "type": "string",
          "minLength": 1,
          "description": "Announcement body text"
        },
        "pinned": {
          "type": "boolean",
          "default": false,
          "description": "Whether this announcement is pinned to top"
        },
        "createdAt": {
          "type": "string",
          "format": "date-time",
          "description": "ISO 8601 creation timestamp"
        },
        "expiresAt": {
          "type": "string",
          "format": "date-time",
          "description": "Optional expiration timestamp"
        }
      },
      "additionalProperties": false
    }
  }
}
